{
  "schemaVersion": 2,
  "ttrpVersion": 1,
  "toolchain": "org.tatrman:ttrp:0.9.0",
  "program": "hero.ttrp",
  "world": {
    "qname": "acme.worlds.prod",
    "fingerprint": "sha256:9f2c00000000000000000000000000000000000000000000000000000000abcd"
  },
  "islands": [
    {
      "name": "acc_prep",
      "engine": "erp_pg",
      "executor": "bash",
      "invocation": "psql",
      "file": "islands/acc_prep.sql",
      "sha256": "sha256:b1b1b1b1b1b1b1b1b1b1b1b1b1b1b1b1b1b1b1b1b1b1b1b1b1b1b1b1b1b1b1b1",
      "retries": 2,
      "onFailureOf": null,
      "connections": ["TTR_CONN_ERP_PG"],
      "params": ["run_date"]
    },
    {
      "name": "summarize",
      "engine": "polars",
      "executor": "bash",
      "invocation": "python3",
      "file": "islands/summarize.py",
      "sha256": "sha256:c0dec0dec0dec0dec0dec0dec0dec0dec0dec0dec0dec0dec0dec0dec0dec0de",
      "retries": 0,
      "onFailureOf": null,
      "connections": [],
      "params": ["run_date"]
    },
    {
      "name": "notify_failure",
      "engine": "erp_pg",
      "executor": "bash",
      "invocation": "psql",
      "file": "islands/notify_failure.sql",
      "sha256": "sha256:f00df00df00df00df00df00df00df00df00df00df00df00df00df00df00df00d",
      "retries": 0,
      "onFailureOf": "acc_prep",
      "connections": ["TTR_CONN_ERP_PG"],
      "params": []
    }
  ],
  "transfers": [
    {
      "from": "acc_prep",
      "to": "summarize",
      "via": "stage",
      "file": "transfers/x0.py",
      "sha256": "sha256:d00dd00dd00dd00dd00dd00dd00dd00dd00dd00dd00dd00dd00dd00dd00dd00d",
      "connections": ["TTR_CONN_ERP_PG", "TTR_CONN_FILES"]
    }
  ],
  "waves": [
    ["acc_prep"],
    ["x0"],
    ["summarize"],
    ["notify_failure"]
  ],
  "params": [
    {
      "name": "run_date",
      "type": "date",
      "required": false,
      "default": "@run-date"
    }
  ],
  "connections": ["TTR_CONN_ERP_PG", "TTR_CONN_FILES"],
  "displays": [
    {
      "name": "main_result",
      "file": "out/main_result.arrow"
    }
  ],
  "lineage": {
    "version": 1,
    "columns": [
      {
        "output": {
          "island": "summarize",
          "relation": "out.main_result",
          "column": "total",
          "materialized": "shop.sales.db.dbo.MAIN_RESULT"
        },
        "inputs": [
          {
            "qname": "shop.sales.db.dbo.ORDER_LINE",
            "column": "AMOUNT"
          }
        ],
        "transform": "aggregate:SUM"
      }
    ]
  },
  "files": {
    "run.sh": "sha256:e0e0e0e0e0e0e0e0e0e0e0e0e0e0e0e0e0e0e0e0e0e0e0e0e0e0e0e0e0e0e0e0",
    "islands/acc_prep.sql": "sha256:b1b1b1b1b1b1b1b1b1b1b1b1b1b1b1b1b1b1b1b1b1b1b1b1b1b1b1b1b1b1b1b1",
    "islands/summarize.py": "sha256:c0dec0dec0dec0dec0dec0dec0dec0dec0dec0dec0dec0dec0dec0dec0dec0de",
    "islands/notify_failure.sql": "sha256:f00df00df00df00df00df00df00df00df00df00df00df00df00df00df00df00d",
    "transfers/x0.py": "sha256:d00dd00dd00dd00dd00dd00dd00dd00dd00dd00dd00dd00dd00dd00dd00dd00d"
  }
}
